{
  "email": "",
  "createdBy": "#SYSTEM00000",
  "active": true,
  "userType": "AP_CLOUD_USER",
  "userProfile": {
    "givenName": "",
    "familyName": "Automater",
    "jobTitle": "Automation Engineer",
    "department": "Automation",
    "supervisor": "Ciene Frith",
    "createdBy": "#SYSTEM00000"
  }
}